price,id,category,surface,title,zip_code,rent
300000,2343293,Restaurant,180,Vente restaurant très forte notoriété Bois Le Roi,,2467
300000,2342635,Restaurant,230,Cède restaurant pizzeria logement à Fontainebleau,77300,2467
856000,2339216,Restaurant,500,AV magnifique restaurant avec chambres à Nangis,77370,2680
199000,2339068,Restaurant,0,Vente restaurant traditionnel à Coubert centre,77170,
636000,2337821,Restaurant,220,Restaurant bar à vins à vendre à Marne la Vallée,,
810000,2335504,Restaurant,760,Vente restaurant à Chelles métro Coteaux Beauclair,,4500
145000,2332862,Restaurant,71,Vente bar tabac restaurant à Pommeuse,77515,
1277977,2332542,Restaurant,240,AV restaurant top emplacement et CA Bray sur Seine,77480,417
570000,2332238,Restaurant,125,Vente restaurant murs et fonds à Mitry-Mory,77290,
542000,2331923,Restaurant,250,AV bar brasserie restaurant centre ville 77 Sud,,
199000,2329947,Restaurant,210,Vente restaurant bien géré sur Mareuil-lès-Meaux,77100,
495000,2043035,Restaurant,0,Vend restaurant lic IV murs commerciaux dept 77,,
320000,2328336,Restaurant,1150,Vente restaurant ZAC Avon proche de Fontainebleau,,
384000,2327154,Restaurant,200,Vente restaurant lic IV à Montévrain axe passant,77144,
242000,2323548,Restaurant,0,Vente restaurant en angle terrasse proche Nangis,,
115914,2323049,Restaurant,100,Vente restaurant tradi à Fontainebleau-Barbizon,77000,1426
175000,2321891,Restaurant,145,Vente restaurant pizzeria terrasse Saint Soupplet,77165,
354000,2321015,Restaurant,92,Vente restaurant à deux pas de Disneyland Paris,77700,3000
480000,2318341,Restaurant,170,Vente restaurant zone touristique de Meaux,77100,
638000,2318297,Restaurant,0,Vente restaurant dans ZI proche Lagny sur Marne,,
56000,2317819,Restaurant,0,Vente  FDC restaurant  au coeur de Coulommiers,77120,
73000,2317555,Restaurant,37,AV FDC restaurant rue piétonne de Meaux centre,77100,1000
310327,2316672,Restaurant,55,Vente restaurant face grand parking sur Melun,77000,92
266000,2307601,Restaurant,200,Vente brasserie restaurant grande ville Nord 77,,
308000,2307398,Restaurant,360,A vendre magnifique restaurant empl N°1 sur Meaux,77100,4200
250000,2307009,Restaurant,216,Vente bar restaurant épicerie à Presle en Brie,77220,
1178000,2306961,Restaurant,0,Vente restaurant murs et fonds en Seine et Marne,,
1102000,2033382,Restaurant,0,Vend restaurant à thème + murs Seine et Marne,,
179000,2302691,Restaurant,70,Vente restaurant en hyper-centre de Meaux,77100,
465000,2302064,Restaurant,150,Vente restaurant dans cadre verdoyant à Chelles,,
